{
  "$schema": "https://json-schema.org/draft/2020-12/schema",
  "$id": "https://github.com/martin98-afk/drifox-plugins/schemas/plugin.schema.json",
  "title": "DriFox Plugin Manifest",
  "description": "plugin.json 字段定义。所有 DriFox 插件必须遵循此 schema。权威参考见 DriFox 运行时内置的 plugins/system/。",
  "type": "object",
  "additionalProperties": false,
  "required": ["name", "description", "version", "components"],
  "properties": {
    "name": {
      "type": "string",
      "pattern": "^[a-z][a-z0-9-]{1,63}$",
      "description": "插件名，小写 kebab-case，必须与插件目录名一致"
    },
    "icon": {
      "oneOf": [
        {
          "type": "string",
          "minLength": 1,
          "description": "图标文件路径，相对 manifest（plugin.json）所在目录"
        },
        {
          "type": "object",
          "additionalProperties": false,
          "required": ["light"],
          "properties": {
            "light": {
              "type": "string",
              "minLength": 1,
              "description": "浅色主题图标路径，相对 manifest 所在目录"
            },
            "dark": {
              "type": "string",
              "minLength": 1,
              "description": "深色主题图标路径，相对 manifest 所在目录"
            }
          },
          "description": "按主题分别指定图标：{ \"light\": \"icon.svg\", \"dark\": \"icon_dark.svg\" }"
        }
      ],
      "description": "插件图标。字符串=单一图标文件；对象=按浅色/深色主题区分"
    },
    "description": {
      "type": "string",
      "minLength": 1,
      "maxLength": 200,
      "description": "一句话说明插件功能"
    },
    "version": {
      "type": "string",
      "pattern": "^(0|[1-9]\\d*)\\.(0|[1-9]\\d*)\\.(0|[1-9]\\d*)(?:-((?:0|[1-9]\\d*|\\d*[a-zA-Z-][0-9a-zA-Z-]*)(?:\\.(?:0|[1-9]\\d*|\\d*[a-zA-Z-][0-9a-zA-Z-]*))*))?(?:\\+([0-9a-zA-Z-]+(?:\\.[0-9a-zA-Z-]+)*))?$",
      "description": "SemVer 2.0 语义化版本"
    },
    "author": {
      "oneOf": [
        { "type": "string", "minLength": 1 },
        {
          "type": "object",
          "additionalProperties": false,
          "required": ["name"],
          "properties": {
            "name": { "type": "string", "minLength": 1 },
            "email": { "type": "string", "format": "email" },
            "url": { "type": "string", "format": "uri" }
          }
        }
      ],
      "description": "作者信息，字符串或对象"
    },
    "homepage": { "type": "string", "format": "uri" },
    "repository": { "type": "string", "format": "uri" },
    "license": {
      "type": "string",
      "minLength": 1,
      "description": "SPDX 标识符，如 GPL-3.0-or-later、MIT"
    },
    "type": {
      "type": "string",
      "enum": ["user", "system"],
      "default": "user",
      "description": "user=用户插件（默认）；system=系统级，需签名"
    },
    "keywords": {
      "type": "array",
      "items": { "type": "string", "minLength": 1 },
      "uniqueItems": true
    },
    "min_host_version": {
      "type": "string",
      "pattern": "^v?\\d+\\.\\d+(\\.\\d+)?$",
      "description": "最低宿主版本（如 \"0.6.10\"）。宿主 app/plugins/version_gate.py 的 check_host_version 读取：不满足则整插件拒载（工具/UI/hooks 全不加载）。格式非法同样拒载。缺省=不限制，老宿主仍可安装。"
    },
    "api_version": {
      "type": "integer",
      "minimum": 1,
      "default": 1,
      "description": "插件 API 契约版本。宿主 HOST_PLUGIN_API_VERSION 当前为 2：声明 2 且未写 capabilities 视为空清单（拿不到任何能力）；声明高于宿主则拒载。缺省=1，兼容期全量放行能力。"
    },
    "capabilities": {
      "type": "array",
      "items": { "type": "string", "minLength": 1 },
      "uniqueItems": true,
      "description": "声明的能力清单（仅 api_version>=2 时参与裁剪），如 [\"session.read\", \"ui.notify\"]。支持通配 \"tool.*\" 与 \"*\"。可用能力见 DriFox docs/plugins/capabilities.md。"
    },
    "components": {
      "type": "object",
      "additionalProperties": false,
      "description": "启用的组件，至少启用一个",
      "anyOf": [
        { "required": ["commands"] },
        { "required": ["hooks"] },
        { "required": ["skills"] },
        { "required": ["agents"] },
        { "required": ["themes"] },
        { "required": ["mcp"] },
        { "required": ["lsp"] },
        { "required": ["ui"] },
        { "required": ["tools"] },
        { "required": ["providers"] },
        { "required": ["storages"] },
        { "required": ["serializers"] },
        { "required": ["engines"] },
        { "required": ["gateways"] },
        { "required": ["loop_policies"] },
        { "required": ["hook_policies"] },
        { "required": ["model_adapters"] },
        { "required": ["team_templates"] }
      ],
      "properties": {
        "tools": {
          "type": "boolean",
          "description": "启用 tools/*.py 工具（每个文件暴露 register(registry)，注册内置工具）"
        },
        "commands": {
          "type": "boolean",
          "description": "启用 commands/*.md 斜杠命令"
        },
        "agents": {
          "type": "boolean",
          "description": "启用 agents/*.md 智能体定义"
        },
        "skills": {
          "type": "boolean",
          "description": "启用 skills/<name>/SKILL.md 技能"
        },
        "themes": {
          "type": "boolean",
          "description": "启用 themes/<theme-name>/*.yaml 主题"
        },
        "hooks": {
          "type": "boolean",
          "description": "启用 hooks/hooks.json 事件钩子"
        },
        "mcp": {
          "type": "boolean",
          "description": "加载 .mcp.json 中的 MCP 服务器配置"
        },
        "lsp": {
          "type": "boolean",
          "description": "加载 .lsp.json 中的 LSP 语言服务器配置"
        },
        "ui": {
          "type": "boolean",
          "description": "加载 ui/__init__.py 中的 UI 组件（浮动卡片 / 内容块渲染器 / 消息元素工厂）"
        },
        "providers": {
          "type": "boolean",
          "description": "启用 providers/*.py 服务商定义（每个文件暴露 register(registry)，注册 AI 服务商）"
        },
        "storages": {
          "type": "boolean",
          "description": "启用 storages/*.py 存储引擎（register 暴露存储后端）"
        },
        "serializers": {
          "type": "boolean",
          "description": "启用 serializers/*.py 序列化器"
        },
        "engines": {
          "type": "boolean",
          "description": "启用 engines/*.py 引擎"
        },
        "gateways": {
          "type": "boolean",
          "description": "启用 gateways/*.py 消息网关适配器"
        },
        "loop_policies": {
          "type": "boolean",
          "description": "启用 loop_policies/*.py 循环策略"
        },
        "hook_policies": {
          "type": "boolean",
          "description": "启用 hook_policies/*.py hook 触发策略（每个文件暴露 register(registry)，注册 HookPolicy 策略对象）"
        },
        "model_adapters": {
          "type": "boolean",
          "description": "启用 model_adapters/*.py 模型适配器"
        },
        "team_templates": {
          "type": "boolean",
          "description": "启用 team_templates/*.md 团队模板"
        },
        "transports": {
          "type": "boolean",
          "description": "启用 transports/ 协议传输层（契约 app.plugins.contracts.protocol_transport）"
        },
        "stream_sinks": {
          "type": "boolean",
          "description": "启用 stream_sinks/ 流式输出落点（契约 app.plugins.contracts.stream_sink）"
        },
        "context_tiers": {
          "type": "boolean",
          "description": "启用 context_tiers/ 系统上下文分层（契约 app.plugins.contracts.context_policy）"
        },
        "budget_resolvers": {
          "type": "boolean",
          "description": "启用 budget_resolvers/ 上下文预算解析器（与 context_tiers 配套）"
        }
      }
    },
    "drifox": {
      "type": "object",
      "additionalProperties": false,
      "description": "DriFox 兼容性声明",
      "properties": {
        "min_version": {
          "type": "string",
          "pattern": "^\\d+\\.\\d+(\\.\\d+)?$"
        },
        "max_version": {
          "type": "string",
          "pattern": "^\\d+\\.\\d+(\\.\\d+)?$|^\\d+\\.x$"
        },
        "events": {
          "type": "array",
          "items": {
            "type": "string",
            "enum": [
              "SessionStart",
              "Stop",
              "UserPromptSubmit",
              "PreUserMessage",
              "PostUserMessage",
              "PreAssistantMessage",
              "PostAssistantMessage",
              "PreToolUse",
              "PostToolUse"
            ]
          },
          "uniqueItems": true
        }
      }
    },
    "config_schema": {
      "type": "object",
      "additionalProperties": false,
      "required": ["fields"],
      "description": "插件配置表单 Schema，供 UI 渲染配置项",
      "properties": {
        "title": {
          "type": "string",
          "description": "配置面板标题"
        },
        "description": {
          "type": "string",
          "description": "配置说明"
        },
        "fields": {
          "type": "array",
          "minItems": 1,
          "items": {
            "type": "object",
            "additionalProperties": true,
            "required": ["key", "label", "type"],
            "properties": {
              "key": { "type": "string", "minLength": 1 },
              "label": { "type": "string", "minLength": 1 },
              "type": { "type": "string" },
              "default": {},
              "placeholder": { "type": "string" },
              "description": { "type": "string" },
              "rows": {},
              "options": {
                "type": "array",
                "items": {
                  "type": "object",
                  "additionalProperties": true,
                  "required": ["label", "value"],
                  "properties": {
                    "label": { "type": "string" },
                    "value": {}
                  }
                }
              }
            }
          }
        }
      }
    },
    "dependencies": {
      "type": "object",
      "additionalProperties": {
        "oneOf": [
          {
            "type": "string",
            "pattern": "^[\\^~>=<]*\\s*\\d+\\.\\d+\\.\\d+.*$",
            "description": "插件依赖：SemVer 范围"
          },
          {
            "type": "object",
            "description": "pip 依赖声明（保留 key pip）：default + 平台 key（win32/linux/darwin），值为规格字符串或数组。运行时见 app/plugins/deps_loader.py resolve_pip_deps",
            "additionalProperties": {
              "oneOf": [
                { "type": "string" },
                { "type": "array", "items": { "type": "string" } }
              ]
            }
          }
        ]
      },
      "description": "插件间依赖（键=插件名，值=SemVer 范围）；dependencies.pip 为 pip 依赖声明"
    },
    "platforms": {
      "type": "array",
      "items": {
        "type": "string",
        "enum": ["windows", "win32", "linux", "darwin", "macos", "mac"]
      },
      "description": "支持平台声明（缺省=全平台兼容）。友好名映射见 app/plugins/deps_loader.py PLATFORM_DIR_MAP"
    }
  }
}
