{
  "name": "hana-conn-zhipu-webreader",
  "description": "智谱 网页读取 — 抓取网页正文与结构化内容。安装后填入智谱 API Key。",
  "icon": {
    "light": "icon.png",
    "dark": "icon.png"
  },
  "version": "1.0.0",
  "author": {
    "name": "liliMozi",
    "url": "https://github.com/liliMozi/hana-connectors"
  },
  "license": "GPL-3.0-or-later",
  "type": "user",
  "drifox": {
    "min_version": "0.5.0"
  },
  "keywords": [
    "mcp",
    "connector",
    "zhipu-webreader"
  ],
  "components": {
    "mcp": true
  },
  "homepage": "https://open.bigmodel.cn/api/mcp/web_reader/mcp"
}
