{
  "name": "hana-conn-edgeone-pages",
  "description": "腾讯云 EdgeOne Pages — 把网页一键部署到 EdgeOne Pages，生成可公开访问的链接。",
  "icon": {
    "light": "icon.png",
    "dark": "icon.png"
  },
  "version": "1.0.0",
  "author": {
    "name": "liliMozi",
    "url": "https://github.com/liliMozi/hana-connectors"
  },
  "license": "GPL-3.0-or-later",
  "type": "user",
  "drifox": {
    "min_version": "0.5.0"
  },
  "keywords": [
    "mcp",
    "connector",
    "edgeone-pages"
  ],
  "components": {
    "mcp": true
  },
  "homepage": "https://mcp-on-edge.edgeone.app/mcp-server"
}
