{
  "name": "hana-conn-github",
  "description": "GitHub — 管理 GitHub 仓库、Issue、PR 与 Actions。安装后填入个人访问令牌。",
  "icon": {
    "light": "icon.png",
    "dark": "icon.png"
  },
  "version": "1.0.0",
  "author": {
    "name": "liliMozi",
    "url": "https://github.com/liliMozi/hana-connectors"
  },
  "license": "GPL-3.0-or-later",
  "type": "user",
  "drifox": {
    "min_version": "0.5.0"
  },
  "keywords": [
    "mcp",
    "connector",
    "github"
  ],
  "components": {
    "mcp": true
  },
  "homepage": "https://api.githubcopilot.com/mcp/"
}
