{
  "name": "semgrep",
  "description": "Semgrep — 扫描代码中的安全漏洞与问题。",
  "icon": {
    "light": "icon.png",
    "dark": "icon.png"
  },
  "version": "1.0.0",
  "author": {
    "name": "liliMozi",
    "url": "https://github.com/liliMozi/hana-connectors"
  },
  "license": "GPL-3.0-or-later",
  "type": "user",
  "drifox": {
    "min_version": "0.5.0"
  },
  "keywords": [
    "mcp",
    "connector",
    "semgrep"
  ],
  "components": {
    "mcp": true
  },
  "homepage": "https://mcp.semgrep.ai/mcp"
}
