{
  "name": "dingtalk-todo",
  "description": "钉钉待办 — 查看、创建和完成钉钉待办。",
  "icon": {
    "light": "icon.png",
    "dark": "icon.png"
  },
  "version": "1.0.0",
  "author": {
    "name": "liliMozi",
    "url": "https://github.com/liliMozi/hana-connectors"
  },
  "license": "GPL-3.0-or-later",
  "type": "user",
  "drifox": {
    "min_version": "0.5.0"
  },
  "keywords": [
    "mcp",
    "connector",
    "dingtalk-todo"
  ],
  "components": {
    "mcp": true
  },
  "homepage": "https://mcp-gw.dingtalk.com"
}
