{
  "name": "hana-conn-dropbox",
  "description": "Dropbox — 搜索和读取你 Dropbox 里的文件。",
  "icon": {
    "light": "icon.png",
    "dark": "icon.png"
  },
  "version": "1.0.0",
  "author": {
    "name": "liliMozi",
    "url": "https://github.com/liliMozi/hana-connectors"
  },
  "license": "GPL-3.0-or-later",
  "type": "user",
  "drifox": {
    "min_version": "0.5.0"
  },
  "keywords": [
    "mcp",
    "connector",
    "dropbox"
  ],
  "components": {
    "mcp": true
  },
  "homepage": "https://mcp.dropbox.com/mcp"
}
