{
  "name": "miro",
  "description": "Miro — 读取和创建 Miro 白板上的内容。",
  "icon": {
    "light": "icon.png",
    "dark": "icon.png"
  },
  "version": "1.0.0",
  "author": {
    "name": "liliMozi",
    "url": "https://github.com/liliMozi/hana-connectors"
  },
  "license": "GPL-3.0-or-later",
  "type": "user",
  "drifox": {
    "min_version": "0.5.0"
  },
  "keywords": [
    "mcp",
    "connector",
    "miro"
  ],
  "components": {
    "mcp": true
  },
  "homepage": "https://mcp.miro.com/"
}
