{
  "name": "stripe",
  "description": "Stripe — 查询和管理 Stripe 的客户、付款、订阅与发票。",
  "icon": {
    "light": "icon.png",
    "dark": "icon.png"
  },
  "version": "1.0.0",
  "author": {
    "name": "liliMozi",
    "url": "https://github.com/liliMozi/hana-connectors"
  },
  "license": "GPL-3.0-or-later",
  "type": "user",
  "drifox": {
    "min_version": "0.5.0"
  },
  "keywords": [
    "mcp",
    "connector",
    "stripe"
  ],
  "components": {
    "mcp": true
  },
  "homepage": "https://mcp.stripe.com"
}
