{
  "name": "vercel",
  "description": "Vercel — 查看 Vercel 项目、部署与日志，并检索 Vercel 文档。",
  "icon": {
    "light": "icon.png",
    "dark": "icon.png"
  },
  "version": "1.0.0",
  "author": {
    "name": "liliMozi",
    "url": "https://github.com/liliMozi/hana-connectors"
  },
  "license": "GPL-3.0-or-later",
  "type": "user",
  "drifox": {
    "min_version": "0.5.0"
  },
  "keywords": [
    "mcp",
    "connector",
    "vercel"
  ],
  "components": {
    "mcp": true
  },
  "homepage": "https://mcp.vercel.com"
}
