{
    "name": "react-pro",
    "description": "React / Next.js 性能优化与最佳实践 — 45 条 RSC 边界、Server Components、App Router、缓存策略、Streaming、Bundle 优化。",
    "icon": {
        "light": "icon.svg",
        "dark": "icon_dark.svg"
    },
    "version": "1.0.0",
    "author": {
        "name": "Vercel Labs",
        "url": "https://github.com/vercel-labs/agent-skills"
    },
    "license": "MIT",
    "type": "user",
    "min_host_version": "0.5.0",
    "keywords": [
        "react",
        "performance",
        "frontend"
    ],
    "components": {
        "commands": true,
        "skills": true
    },
    "homepage": "https://nextjs.org"
}
