{
    "name": "web-design-skills",
    "description": "网页设计技能——使用 HTML/CSS/JavaScript/React 构建和重新设计高质量的视觉网页作品。",
    "icon": {
        "light": "icon.png",
        "dark": "icon_dark.png"
    },
    "version": "1.3.0",
    "author": {
        "name": "ConardLi"
    },
    "license": "MIT",
    "type": "user",
    "min_host_version": "0.5.0",
    "keywords": [
        "frontend",
        "html",
        "css",
        "react",
        "前端"
    ],
    "components": {
        "skills": true
    }
}
