{
    "name": "live-data",
    "description": "实时数据查询 — 汇率、A股、大盘指数、金价、npm/PyPI/GitHub 包信息、天气、B站视频数据、IP 归属地，8 个免密钥公开接口聚合为 4 个工具。",
    "icon": {
        "light": "icon.svg",
        "dark": "icon_dark.svg"
    },
    "version": "0.1.0",
    "author": {
        "name": "black"
    },
    "license": "MIT",
    "type": "user",
    "min_host_version": "0.5.0",
    "keywords": [
        "live-data",
        "finance",
        "weather",
        "npm",
        "pypi",
        "github",
        "bilibili",
        "ip"
    ],
    "components": {
        "tools": true,
        "commands": false,
        "agents": false,
        "skills": false,
        "hooks": false,
        "mcp": false,
        "lsp": false,
        "themes": false
    }
}
