{
  "name": "hana-conn-baidu-map",
  "description": "百度地图 — 地点检索、路线规划、实时路况与天气查询。",
  "icon": {
    "light": "icon.png",
    "dark": "icon.png"
  },
  "version": "1.0.0",
  "author": {
    "name": "liliMozi",
    "url": "https://github.com/liliMozi/hana-connectors"
  },
  "license": "GPL-3.0-or-later",
  "type": "user",
  "drifox": {
    "min_version": "0.5.0"
  },
  "keywords": [
    "mcp",
    "connector",
    "baidu-map"
  ],
  "components": {
    "mcp": true
  },
  "homepage": "https://mcp.map.baidu.com/mcp"
}
