{
  "name": "zhipu-websearch",
  "description": "智谱 联网搜索 — 通过智谱开放平台进行实时联网搜索。安装后填入智谱 API Key。",
  "icon": {
    "light": "icon.png",
    "dark": "icon.png"
  },
  "version": "1.0.0",
  "author": {
    "name": "liliMozi",
    "url": "https://github.com/liliMozi/hana-connectors"
  },
  "license": "GPL-3.0-or-later",
  "type": "user",
  "min_host_version": "0.5.0",
  "keywords": [
    "mcp",
    "connector",
    "zhipu-websearch"
  ],
  "components": {
    "mcp": true
  },
  "homepage": "https://open.bigmodel.cn/api/mcp/web_search_prime/mcp"
}
